{"question_id":"question_010","classification":"known_general","answer":"출입통제 기록의 보존과 확인 방식은 제 보안 업무 범위입니다. 다만 CCTV 영상, 서버 내부 보안 로그, 저장매체 반출입 기록의 관리 주체나 열람 가능 여부는 제가 확인할 수 있는 범위가 아닙니다.","matched_rule_id":null,"rationale":"선택 가능 규칙이 없고, 대상 NPC는 출입통제 기록 보존 방식만 알고 있으며 CCTV·서버 내부·저장매체 기록의 관리 및 내용은 알지 못한다."}