{"question_id":"question_008","classification":"known_general","answer":"장비 대여비 150,000원은 제가 법인카드로 결제했고 영수증을 제출했습니다. 다만 저는 마진 씨가 21시 전후 실제로 떠나는 장면을 보지 못했고, 그의 출입카드를 다른 사람이 사용할 수 있었는지나 서버실 출입 이유도 알지 못합니다.","matched_rule_id":null,"rationale":"선택 가능 규칙이 없고, 대상 NPC는 E01의 결제 사실만 직접 알며 마진의 실제 퇴근·출입카드 사용·서버실 출입 사유는 지식 범위 밖이다."}