{"question_id":"question_003","classification":"unknown","answer":"출입 기록상 해당 시각에 그 명의의 카드로 문이 열렸다는 점은 확인할 수 있습니다. 다만 저는 그 순간의 실제 출입자를 직접 보지 못했고, 서버실 안에서 어떤 작업이나 저장매체 반출입이 있었는지는 알지 못합니다.","matched_rule_id":null,"rationale":"선택 가능 규칙이 없으며, 보안 담당 NPC는 출입기록 보존 범위만 알고 서버실 내 작업·매체 사용이나 실제 카드 소지자는 직접 확인하지 못했다."}