{"question_id":"question_011","classification":"insufficient_grounding","answer":"제시된 퇴근 발언과 카드 기록만으로는 실제 출입자나 카드 사용 경위를 단정할 수 없습니다. 그 부분은 별도의 확인 가능한 기록이 있어야 판단할 수 있습니다.","matched_rule_id":null,"rationale":"선택 가능 규칙이 없으며, E02·E03의 시간상 모순은 제시됐지만 질문의 관계 유형은 actor_device_sequence이고 해당 관계에 필요한 장치 연결 사실이 없다. 핵심 출입 사실을 해금 없이 공개할 수 없다."}