{"question_id":"question_006","classification":"insufficient_grounding","answer":"제시된 두 기록만으로는 서버실 출입 뒤 결선 데이터나 저장매체를 열람·복사·이동했다는 점까지 확인할 수 없습니다. 그 부분은 별도의 확인 가능한 기록이 필요합니다.","matched_rule_id":null,"rationale":"선택 가능 규칙이 없으며, 질문은 E02와 E03의 시간상 모순을 제시하지만 relation이 actor_device_sequence로 지정되어 있고 해당 관계에 필요한 장치 연결 공개 사실은 없다. 미공개 데이터·저장매체 행위를 답변으로 선제 공개할 수 없다."}