{"question_id":"question_001","classification":"known_general","answer":"제가 직접 확인한 장비 대여비는 법인카드로 결제한 150,000원이며, 영수증도 제출했습니다. 그 밖의 추가 장비·현장 비용이나 별도 영수증, 지급 방식은 제가 확인한 내용이 아닙니다.","matched_rule_id":null,"rationale":"질문 대상 NPC는 150,000원 결제와 영수증 제출만 직접 알고 있으며, 마진의 정산 작성·추가 비용 여부는 알지 못한다. 선택 가능 규칙이 없다."}