{"question_id":"question_002","classification":"fact_confirmed","answer":"실제 장비 대여비가 150,000원이었던 것은 맞습니다. 제가 제출한 450,000원과는 300,000원 차이가 납니다. 당시에는 이를 추가 현장비라고 적었지만, 별도 증빙은 제시하지 못했습니다.","matched_rule_id":"U01_AMOUNT_GAP","rationale":"E01과 E02가 질문 문장에 직접 제시되었고, 동일 장비 정산의 150,000원과 450,000원 사이 300,000원 차이를 명확히 연결했다."}